schema_type,title,notes,organization_title,language,license_id,privacy_impact_assessment_number,date_of_approval,metadata_created,metadata_modified,dkan_uri,dkan_node_id
pia-summaries,WorkHub Software Use,"The Transportation Maintenance Branch (TMB) Safety and Operations Unit has developed and is using an Operational Management System (WorkHub) software for managing program information. This information includes employee training, competency and incident management data.",Highways and Public Works,,OGL-Yukon-2.0,HPW-PIA-2023-09,2023-05-25,2023-12-08 11:33:53,2024-06-24 12:03:28,https://open.yukon.ca/access-information/privacy-impact-assessment-summary/workhub-software-use,59452
pia-summaries,Yukon Government Spatial Data Information Platform,"This PIA covers the spatial data and the two distribution platforms currently on offer by the Geomatics Yukon unit in the eServices for citizens branch of the Yukon Government. GeoYukon is an interactive mapping application containing the Government of Yukon's authoritative and current mapa data, provided as a free public service.",Highways and Public Works,,OGL-Yukon-2.0,HPW-PIA-2023-10,2023-12-12,2023-12-12 13:16:17,2024-06-24 12:03:52,https://open.yukon.ca/access-information/privacy-impact-assessment-summary/yukon-government-spatial-data-information,59463
pia-summaries,Visitor Information Centres PIA Amendment Phase 2: Wi-Fi and QR Codes,"The Visitor Services branch of YG's Tourism and Culture (T&C) department is seeking to gain visitors' information when they visit Yukon, such as: where they are visiting from and what their experience is like at the Visitor Information Centers (VICs). This initiative collects data to obtain a well-rounded profile of visitors to the Yukon to enhance efforts in attracting visitors to the Yukon which will support tourism industry and improve the VIC user's experience. There are two phases for this project involving:

*   Phase 1: the implementation of web forms at the VICs to gather visitor information and and visitor feedback.

*   Phase 2: the assessment of the dedicated guest Wi-Fi at the VICs and the implementation of QR codes to access web forms and other information.",Tourism and Culture,,OGL-Yukon-2.0,TC-PIA-2022-04,2022-10-06,2024-01-11 08:55:27,2024-06-25 09:17:56,https://open.yukon.ca/access-information/privacy-impact-assessment-summary/visitor-information-centres-pia-amendment-phase,59509
pia-summaries,Small Business Flood Recovery Funding Program,"The Small Business Flood Recovery Funding Program is a one-time program providing financial assistance to small business owners who were impacted by and incurred significant uninsured damages and loss as a result of the May 2023 flooding in the Klondike Valley area.

Effective Jun 30, 2023 - Oct 3, 2023

All supporting documentation must be submitted by Oct 1, 2024",Economic Development,,OGL-Yukon-2.0,ECD-PIA-2024-01,2024-01-05,2024-01-15 07:54:00,2024-01-15 07:54:00,https://open.yukon.ca/access-information/privacy-impact-assessment-summary/small-business-flood-recovery-funding-program,59514
pia-summaries,Fish and Wildlife Data Sharing Policy and Procedures,"The Fish and Wildlife Branch (FWB) is implementing a data sharing policy to guide how ecological data is accepted from third parties, manage ecological data that have restrictions on the way they may be used, and share ecological data with others. In terms of informal data requests, the policy ensures that the way ecological data is accepted and shared will be in accordance with the ATIPP Act. FWB is committed to sharing ecological data as openly as possible, while ensuring that sharing this data does not negatively impact series and ecosystems, as well as the way to manage a sustainable harvest and the working relationship with others. This policy is needed to ensure that sharing of ecological data is consistent and transparent and the reasons why an informal data request may be denied.",Environment,,OGL-Yukon-2.0,ENV-PIA-2023-05,2023-11-14,2024-01-15 09:02:23,2024-01-15 09:06:04,https://open.yukon.ca/access-information/privacy-impact-assessment-summary/fish-and-wildlife-data-sharing-policy-and,59515
pia-summaries,"HPW-TTC, Participation Plan Monitoring Agreement","The Highways and Public Works and Teslin Tlingit Council (HPW-TTC) - Participation Plan Monitoring Agreement PIA will focus on the collection, use, and disclosure of the Yukon First Nation participation levels for the bridge replacement project at the Nisutlin Bay Bridge. The information is to be collected by the Graham Construction Ltd (the contractor) and will be submitted to HPW to ensure compliance with the TTC participation plan.",Highways and Public Works,,OGL-Yukon-2.0,HPW-PIA-2023-11,2023-05-02,2024-01-17 09:37:44,2024-06-24 12:04:07,https://open.yukon.ca/access-information/privacy-impact-assessment-summary/hpw-ttc-participation-plan-monitoring-agreement,59521
pia-summaries,Temporary Landlord Assistance Program,"The Temporary Landlord Assistance Program (TLAP) provides a one-time rebate to landlords for units that were available for rent during the 2023 calendar year. Landlords can apply for a payment of $338 per unit.
The program helps residential landlords affected by the change in rent cap regulations for the 2023 calendar year. Rent increases are now capped at a maximum of 5 per cent.

Announced Oct 19, 2023. Effect Nov 2, 220 - Feb 29, 2024",Economic Development,,OGL-Yukon-2.0,ECD-PIA-2024-02,2024-01-17,2024-01-18 07:18:01,2024-01-18 07:18:01,https://open.yukon.ca/access-information/privacy-impact-assessment-summary/temporary-landlord-assistance-program,59523
pia-summaries,Wildlife Mortalities Service,"The Department of Environment tracks wildlife mortality information from the different types of harvesting methods (i.e. hunting, trapping, outfitting) and human/wildlife conflict. The animals that must be reported for the activities are: big game animals, wolf, lynx, fox, wolverine, and any animal that is protected under the Wildlife Act. Currently, the Department of Environment is tracking wildlife mortality data through a paper-based process and is taking steps to become more digital in its processes for the ease of access to clients. The new Wildlife Mortalities Service system will replace the Harvest Database and this system will issue the Wildlife Export permits and communicate with the departmental licensing and permitting system (POSSE), SQL Server and AIMES system. The Wildlife Mortalities Service will also access data stored in the department's human-wildfire conflict reporting app. The communication between the systems will mitigate the need for clients to supply the department with the same information twice. This PIA will only focus on the collection, use, and disclosure of personal information involving the Wildlife Mortalities Service.",Environment,,OGL-Yukon-2.0,ENV-PIA-2024-01,2024-01-17,2024-01-18 11:58:45,2024-01-18 11:58:45,https://open.yukon.ca/access-information/privacy-impact-assessment-summary/wildlife-mortalities-service,59525
pia-summaries,Canto Cumulus System Service Expansion,"This Privacy Impact Assessment (PIA) covers the system usage expansion inclusive to all Yukon departments since the original PIA focuses only on Tourism and Culture, Economic Development, Environment, and Cabinet. The service expansion now covers the remaining departments in the Yukon Government namely: Community Services (CS), Education (EDU), Energy, Mines and Resources (EMR), Executive Council Office (ECO), Finance (FIN), Health and Social Services (HSS), Highways and Public Works (HPW), Justice (JUS), French Language Services Directorate (FLSD), Public Service Commission (PSC), Women and Gender Equity Directorate (WGED), Worker's Safety and Compensation Board (WSCB), Yukon Development Corporation (YDC), Yukon Energy Corporation (YEC), Yukon Housing Corporation (YHC), Yukon Liquor Corporation (YLC), Yukon Lottery Commission (YLC), and Lotteries Yukon.
The expansion also allow the administrative tier to reside with the T&C and ECO while all other departments being the system users. The Canto Cumulus will manage the inventory of digital media as all system users will be moving their digital assets from the on-premises software to the Canto Cumulus system.",Executive Council Office,,OGL-Yukon-2.0,ECO-PIA-2024-01,2024-01-23,2024-01-24 10:27:41,2024-01-24 10:27:41,https://open.yukon.ca/access-information/privacy-impact-assessment-summary/canto-cumulus-system-service-expansion,59541
pia-summaries,Culture Programs,"The Department of Tourism and Culture introduced 3 new public creative and cultural funding programs being distributed by the Arts Unit and this PIA covers the collection, use, disclosure, and storage of information involving in the following funding programs:

*   The Express Micro-grant - an arts funding program to provide support to Yukon first-time applicants in the creative and cultural industries.

*   The Indigenous Artists and Cultural Carriers Micro-grant - an arts funding program established with the Canada Council for the Arts. The program provides funding to Indigenous artists, arts workers and cultural carriers.

*   The Creative and Cultural Career Advancement Fund - an arts funding program to provide a fixed amount of $50,000 to Yukon residents in the creative and cultural industries.",Tourism and Culture,,OGL-Yukon-2.0,TC-PIA-2023-03,2023-12-05,2024-01-24 14:40:57,2024-01-24 14:40:57,https://open.yukon.ca/access-information/privacy-impact-assessment-summary/culture-programs,59542
pia-summaries,Jira Service Management,"The Yukon Government (YG) is revamping its public service and forms management, as well as reporting capabilities with Highway and Public Works (HPW) eServices leading a strategic effort to modernize, standardize, and digitize services by increasing their capabilities in terms of the complexity of and the range of services offered to departments. Highway Three Solutions (contractor) was provided with an extensive requirements list that incorporated the details of the forms management solution being sought to embed with eServices service delivery lifecycle and determined that leveraging Atlassian’s Jira Service Management (JSM) cloud solution met the requirements that IT, operations, and business teams can use to quickly respond to, resolve, and report on service requests and incidents. JSM is integrated with Jira and other Atlassian software already in use by YG and configured to YG's teams and services to enable easier collaboration, faster issue resolution, and instant access to real-time analytics to measure performance and workload. The solution’s self-service portal will be configured for both internal and external users, with the intent that it will be utilized primarily for internal YG departments/programs using the forms for approvals, processing requests, and similar workflow.",Highways and Public Works,,OGL-Yukon-2.0,HPW-PIA-2024-01,2024-01-24,2024-01-30 12:31:17,2024-01-30 12:31:17,https://open.yukon.ca/access-information/privacy-impact-assessment-summary/jira-service-management,59562
pia-summaries,Public Health Information Exchange (“PHIX”) Application,"This Citizen Submission Portal PIA Addendum is being conducted to document the inclusion of the Public Health Information Exchange (“PHIX”) into the suite of existing Panorama applications and integrations.  
PHIX is a tool that was developed to transfer information from web portals and/or other applications into Panorama.  The tool is now being expanded to support the submission of vaccine information for all types of vaccines. The submission process involves using an online form portal called the Public Health Information Exchange (""PHIX""), which interfaces with Panorama. Information submitted via the PHIX portal will be automatically matched against 
existing records in Panorama using a matching algorithm. Where the submission is able to be matched to an existing record, the record will be reviewed by trained reviewers to confirm accuracy and submit the information to Panorama.",Health and Social Services,,OGL-Yukon-2.0,HSS-PIA-2024-01,2024-02-21,2024-02-29 10:32:34,2024-02-29 10:32:34,https://open.yukon.ca/access-information/privacy-impact-assessment-summary/public-health-information-exchange-“phix”,59632
pia-summaries,Yukon Parks Online Reservation System Project,"In accordance with departmental mandate, the Yukon Parks branch has completed a new parks strategy to support the future planning and development of Yukon parks and campgrounds. The strategy includes the introduction of online reservation options to improve fair access to some campsites in some road accessible campgrounds. The online reservation covers the seven identified Yukon Campgrounds:
4 Front-country Campgrounds:
 *  Pine Lake Campground
 *  Tombstone Mountain Campground
 *  Marsh Lake
 *  Wolf Lake

3 Backcountry Campgrounds
 *  Grizzly Lake Campground
 *  Talus Lake Campground
 *  Divide Lake Campground",Environment,,OGL-Yukon-2.0,ENV-PIA-2024-02,2024-03-05,2024-03-06 15:37:31,2024-03-06 15:37:31,https://open.yukon.ca/access-information/privacy-impact-assessment-summary/yukon-parks-online-reservation-system-project,59723
pia-summaries,TSB Central Issuance (Veridos),"This pertains to the production of Yukon government identification cards, specifically the driver's licenses and the general identification cards (GICs), issued by the Department of Highways and Public Works (HPW), Transit Services, Motor Vehicles Branch. GICs are issued if the individual does not have authorization for a Drivers License. 

Veridos will replace the outdated card printing technology currently used by HPW as it no longer meets the updates security standards required for government identification. The outdated process includes in-house printing and laminated-based security. Current security standards across North America are for a laser engraved polycarbonate ID card, which is not producible by HPW independently. By partnering with Veridos, the Yukon Government aims to establish a reliable, high-security card printing service and improve the security, integrity, and overall quality of Yukon government-issued credentials.",Highways and Public Works,,OGL-Yukon-2.0,HPW-PIA-2024-02,2024-03-14,2024-03-15 08:29:12,2024-03-15 08:29:12,https://open.yukon.ca/access-information/privacy-impact-assessment-summary/tsb-central-issuance-veridos,59975
pia-summaries,Canada-Yukon Housing Homeowner Benefit,"The Canada-Yukon housing Homeowner Benefit provides a one-time payment to help eligible Yukon homeowners with their housing costs. To be considered for the benefit, homeowners must be spending 50 percent or more of their gross household income on housing costs. This includes mortgage payment, property tax, home insurance, home repairs, heating fuel and electricity and applicants must meet all other eligibility requirements. This program, launched March 8, 2024, will close when fully subscribed or on March 26, 2024 at 4:00 p.m. (whichever occurs first).",Yukon Housing Corporation,,OGL-Yukon-2.0,YHC-PIA-2024-01,2024-03-18,2024-03-19 08:44:13,2024-06-24 14:27:55,https://open.yukon.ca/access-information/privacy-impact-assessment-summary/canada-yukon-housing-homeowner-benefit,59985
pia-summaries,M365 - Universal Print,"This is an addendum PIA of the M365 Cloud Services PIA which is to expand its coverage to Universal Print. The Universal print by Microsoft is a cloud-based print solution that simplifies print management for organizations. It enables printing from anywhere, eliminates the need for on-premises print servers, and offers centralized management through the M365 admin center. The scope of this PIA involves assessing how personal data will be handled within the system, including the evaluation of security measures, access controls, and data protection mechanisms to ensure compliance with privacy regulations and YG policies.",Highways and Public Works,,OGL-Yukon-2.0,HPW-PIA-2024-03,2024-03-21,2024-03-25 08:52:23,2024-03-25 08:52:23,https://open.yukon.ca/access-information/privacy-impact-assessment-summary/m365-universal-print,59999
pia-summaries,Training Programs - Federal International Student Program - Implementing Federal Minister Instructions for Provincial Attestation Letter,"The federal government, through its International Student Program (ISP) under the Immigration and Refugee Protection Act (IRPA) and its regulation from the Immigration, Refugee and Citizenship Canada (IRCC) has a Memorandum of Understanding (MOU) with the Yukon Government Department of Education. The purpose of the program is to facilitate entry of international students for the primary purpose of studying in Canada. The MOU acknowledges that information sharing between the federal and territorial government is required to administer the program. In addition, this PIA addresses the privacy considerations for using a Yukon Government SharePoint Collab Site with role-based limited permissions for Designated Learning Institution (DLI) external parties to request and for Education to issue the Provincial Attestation Letters (PALs) that contain personal information of foreign national applicants intending to study at a Yukon DLI.",Education,,OGL-Yukon-2.0,EDU-PIA-2024-01,2024-03-22,2024-03-25 09:44:13,2024-03-25 09:44:13,https://open.yukon.ca/access-information/privacy-impact-assessment-summary/training-programs-federal-international-student,60001
pia-summaries,Property Assessment and Tax Solution System (AtENT),"This initiative relates to the replacement of the current Property Assessment and Taxation office (PAT) systems, with a single, modern, end-to-end property assessment, valuation, and taxation platform for use within the Yukon Territory. The PAT office has determined a replacement system is needed, as there is concern regarding the future support of the mainframe infrastructure. The new system implemented is called the ATENT Assessment & Tax (ATENT system). It is a property assessment and tax solution that provides a web-based, GIS-enabled tool set to help agencies, such as PAT, manage appraiser business processes and the entire property tax life cycle. It is a comprehensive solution delivering a suite of tools for computer-aided mass appraisal, personal property valuation, assessment administration, and tax billing.",Community Services,,OGL-Yukon-2.0,CS-PIA-2024-01,2024-03-27,2024-03-27 13:28:20,2024-03-27 13:28:20,https://open.yukon.ca/access-information/privacy-impact-assessment-summary/property-assessment-and-tax-solution-system,60008
pia-summaries,SafetyLine,"This Privacy Impact Assessment (PIA) is on the SafetyLine Application used by Yukon Government, Department of Health and Social Services (HSS). The SafetyLine application allows HSS to monitor the geo-location status of remote staff working alone or in hazardous situations, establishes automated check-in monitoring, and provides an emergency notification service, if required. SafetyLine will be installed and used on HSS owned cell phones provided to Continuing Care employees who work remotely or travel as part of their job role. Employee personal cell phones will not be used for these purposes - only work-issued devices.`",Health and Social Services,,OGL-Yukon-2.0,HSS-PIA-2024-02,2024-04-02,2024-04-03 08:42:20,2024-04-03 08:47:49,https://open.yukon.ca/access-information/privacy-impact-assessment-summary/safetyline,60018
pia-summaries,Remote Travel Program (Garmin in Reach Device),"The Capital Development and Major Projects branch of the Department of Highways and Public Works (HPW) identified a gap in the health and safety system of the branch for employees travelling outside of areas with cellular reception for the purpose of work. As a result of this gap analysis, a Remote Travel program was created to address these issues using framework and existing programs found within other YG departments. The project involves the use of Garmin in Reach Messenger devices with Global positioning systems (GPS) capabilities that allow staff to communicate in areas of the Yukon that lack cellular coverage for the purpose of work travel. This PIA ensures that the collection, use, disclosure, and retention of personal information necessary for the implementation of this program will be identified and that any potential privacy risks can be addressed by providing applicable privacy mitigating measures.",Highways and Public Works,,OGL-Yukon-2.0,HPW-PIA-2024-05,2024-03-28,2024-04-03 09:29:22,2024-04-03 15:22:47,https://open.yukon.ca/access-information/privacy-impact-assessment-summary/remote-travel-program-garmin-reach-device,60019
pia-summaries,Yukon Government Spatial Data Information Platform (Update),"This PIA is an update to the existing HPW-PIA-2023-10 covering the spatial data and the two distribution platforms currently on offer by the Geomatics Yukon unit in the eServices for citizens branch of the Yukon Government. The GeoYukon is an interactive mapping application containing the Government of Yukon's authoritative and current mapping data, provided as a free public service. With the current update, it will include the ArcGIS Online cloud hosting platform for sharing web maps and web mapping applications using this link: https://yukon.maps.arcgis.com/.",Highways and Public Works,,OGL-Yukon-2.0,HPW-PIA-2024-04,2024-03-27,2024-04-03 15:31:25,2024-04-03 15:32:24,https://open.yukon.ca/access-information/privacy-impact-assessment-summary/yukon-government-spatial-data-information-0,60020
pia-summaries,Electronic and Online Licensing System (POSSE),"The Department of Environment implemented an Electronic Online Licensing System (EOLS) in 2015. The purpose of electronic licensing is to enable Yukon citizens and visitors to acquire various licenses, permits, and other authorizations through a self-serve, account-based, online service. EOLS was also implemented to provide the department with account-based administration of licenses and permits, including issuing authorizations through application-review-approval processes and receive approved authorizations online through their client accounts. 
The department is moving toward a digital process for license and permit applications. A digital process will streamline the application and issuing process and mitigate human error. Additional benefits for a digital process include but is not limited to: implementation structured security measures, automating processes, provide more accessibility and control over their personal information within POSSE and provide staff more accessibility to process applications.",Environment,,OGL-Yukon-2.0,ENV-PIA-2024-03,2024-04-05,2024-04-11 08:43:23,2024-04-11 08:43:23,https://open.yukon.ca/access-information/privacy-impact-assessment-summary/electronic-and-online-licensing-system-posse,60037
pia-summaries,Sport & Recreation Use of Checkbox,"The reporting and application forms for the Sport and Recreation Branch's (SARB) suit of grants will be updated by shifting to the use of Checkbox. The Checkbox will likewise be used for registration/sign-up forms and stakeholder/client surveys. This also includes the shift of the Foundations and Podium Pathway grants from the Drupal online format to Checkbox, as well as migrating PDF grant forms to Checkbox. This addresses challenges encountered when piloting the Drupal system for the 2022 intake. The Checkbox allows processes for application and reporting easier for the grant recipients as well as for the adjudication and review committees.",Community Services,,OGL-Yukon-2.0,CS-PIA-2024-02,2024-04-30,2024-05-01 10:09:04,2024-05-01 10:09:04,https://open.yukon.ca/access-information/privacy-impact-assessment-summary/sport-recreation-use-checkbox,60052
pia-summaries,Dragon Medical One,"This initiative is for the use of Nuance's Dragon Medical One (DMO) by Yukon Government, Department of Health and Social Services (HSS). DMO is a cloud-based speech recognition and dictation software that converts speech into text and is used by HSS to support client interactions in clinical settings.
Care Provider's dictation is immediately transcribed to text on their HSS workstation and sent directly into the user interface of the Electronic Medical Record (EMR) system, allowing Care Providers to speak rather than manually type information about their clients. By using DMO in care settings, Care Providers can complete reports in real-time with self-editing capabilities and have access to finalized reports in HSS EMRs.
While the purpose of the PIA is to document the translation to text into client EMRs, the DMO product may also be used by HSS employees to translate to text for other purposes beyond client interactions.",Health and Social Services,,OGL-Yukon-2.0,HSS-PIA-2024-03,2024-04-30,2024-05-02 15:30:38,2024-05-02 15:30:38,https://open.yukon.ca/access-information/privacy-impact-assessment-summary/dragon-medical-one,60054
