schema_type,title,notes,organization_title,language,license_id,privacy_impact_assessment_number,date_of_approval,metadata_created,metadata_modified,dkan_uri,dkan_node_id
pia-summaries,Yukon Emergency Relief Program,"The Yukon Emergency Relief Program (YERP) supports Yukon businesses and nongovernment organizations (NGOs) impacted by the state of emergency declared on November 8, 2021, and restrictions imposed under the Civil Emergency Measures Act (CEMA). The funding program focuses on funding eligible fixed costs for businesses and non-recoverable financial commitments or incremental expenses incurred by NGOs for events cancelled or significantly altered due to CEMA orders.
The program is very similar to the Yukon Business Relief Program (YBRP) which was discussed in detail in the COVID-19 Stimulus Programs updated PIA completed in September 2021 (included in Appendix D). As noted in that PIA, any information collected relates to a business and not a specific individual.
YERP provides funding for eligible businesses that can demonstrate operating at a deficit as a direct result of the state of emergency. Funding is to cover eligible costs incurred from November 13, 2021 until 2 weeks following the end of the state of emergency. Documents
that applicant businesses will submit to support their application will include business revenue and fixed costs. Eligible fixed costs include: property taxes; business insurance; commercial rent or lease; electricity and heating; business licenses; mortgage interest on owned business premises; pest control; software, data services and financial and booking systems; telephone, cable, internet and satellite; vehicle leasing for vehicles used solely by the business; water, sewage and waste disposal. Home-based businesses are not eligible for
YERP.
YERP also provides funding for NGOs that can demonstrate they incurred costs relating to an event that was cancelled or significantly altered. Eligible events are those that were scheduled before November 8, 2021 and were intended to occur between November 13,
2021 and January 1, 2022. Due to additional restrictions imposed, the program was adjusted to include events scheduled between January 7 and February 5, 2022, or while the state of emergency was in place. The NGO may be eligible to receive a rebate to cover the actual
amounts incurred due to the cancellation of the event, or incremental costs for significantly altering the event in order to comply with health and safety measures (such as requiring a larger venue to accommodate the same number of guests). Examples of events include
conferences, trade and craft fairs; workshops with more than 25 confirmed participants; and seated, ticketed events (such as arts and sports). In this NGO stream, eligible costs may include perishable food and drinks; printing and advertising services; service booking and
cancellations with vendors; venue rental costs.
The program ended March 31, 2022.",Economic Development,,OGL-Yukon-2.0,ECD-PIA-2022-01,2022-05-25,2022-08-01 09:18:59,2022-08-01 09:18:59,https://open.yukon.ca/access-information/privacy-impact-assessment-summary/yukon-emergency-relief-program,56656
pia-summaries,Interactio - Remote Live Language Interpretation Services,"Background
Pursuant to the Yukon Languages Act, Government of Yukon departments and corporations must provide services and information in French to the public.
Public events such as workshops or information sessions are typically delivered in English only. Departments report that offering them in French can be challenging. Currently, this can be done either by enlisting a French-speaking facilitator and delivering a session in French, or flying in professional interpreters from outside the territory.
In the last 3 or 4 years, the market for conference interpretation has transformed as digital solutions became viable options for sustainable and flexible service offering. Interactio is a European company that provides such a service.
Interactio, a Lithuanian company, developed an app that provides live interpretation services for public presentations. The app lets users listen to a live audio translation (provided by interpreters working remotely) of a presentation on their own device. Since the translated
audio feed is cloud-based, attendees can tune in from anywhere in the world.
Interactio is compliant with the Association of International Conference Interpreters, who sets the standards for quality assurance in conference interpretation.
FLSD will establish a contract with Interactio and offer the app as a corporate solution to departments. Interactio can help YG overcome current challenges related to increasing French-language access to public.
Current state
FLSD piloted Interactio in September 2019 when Department of Health and Social Service (HSS) executives gathered for a 3-hour planning session for a healthcare clinic with bilingual services. All 12 users who tried the service were highly satisfied with it. 100% of users found
the service easy to use and would use this service again.
FLSD is currently completing all required assessments and examining procurement options before signing a contract with Interactio.",French Language Services Directorate,,OGL-Yukon-2.0,FLS-PIA-2021-01,2022-05-17,2022-08-01 09:48:28,2022-08-01 09:48:28,https://open.yukon.ca/access-information/privacy-impact-assessment-summary/interactio-remote-live-language-interpretation,56657
pia-summaries,Independent Legal Advice,"The Victim Services Branch, Department of Justice provides services for victims of crime. The branch maintains a staff of approximately 18 people and is committed to delivering culturally appropriate and trauma-informed services.
The Independent Legal Advice (ILA) Project provides victims of intimate partner violence and/or sexualized violence with free legal advice and information.
The ILA project is managed by the Victim Services Branch and is for survivors of sexualized violence or intimate partner violence who want to explore their legal options. There is no requirement that an incident be reported to the police. Survivors can access the program at any time whether the incident took place recently, a few weeks or months ago, or if the case is historical The Independent Legal Advice Project is funded through an agreement with the Government of Canada. The project began providing service on May 7, 2020 and is scheduled to end on March 31, 2021. The project will be evaluated to determine if it met the objectives. Victim Services has submitted a proposal to the federal government for an additional five years of funding (2021- 2026).",Justice,,OGL-Yukon-2.0,JUS-PIA-2021-01,2021-03-17,2022-08-01 09:57:10,2022-08-01 09:57:10,https://open.yukon.ca/access-information/privacy-impact-assessment-summary/independent-legal-advice,56658
pia-summaries,Yukon Road Trip Application,"The recommendation for creating a stand-alone mobile application emerged from the Digital Media Plan for Historic Sites (2015). The development of The Yukon Road Trip Mobile Application (""Road Trip Application"") follows a one-government approach by merging information held by different departments into a digital product to meet public user needs. 
The purpose of this project is to create a bilingual (English/French) mobile application that provides information regarding the amenities available at highway accessible campgrounds, cultural and historical points of interest, and wildlife viewing opportunities throughout the Yukon territory. The target audience is ""travellers within Yukon"" - both tourists and Yukon residents. The Yukon Road Trip Application will be evaluated after one year to gauge reach and effectiveness. Format and content changes may be undertaken following this evaluation. 
There are 278 highway accessible sites provided in the Road Trip Application. The Government of Yukon departments of Tourism and Culture, and Environment have published public information stored on the Yukon.ca website. The Road Trip Application will be available for download via Google Play for Android devices and the Apple App store for Apple/iOS devices. 
This is a cross-departmental project team with representatives from the departments of Highways and Public Works ICT e-Services, Environment's Wildlife Viewing Program and Yukon Parks, and Tourism and Culture's Historic Sites Unit. Public launch date is estimated for the winter of 2021.
Once launched, the Road Trip Application will be available to the public for the foreseeable future. 
The Road Trip Application will be launched in three phases: 
1.	Restricted Private Beta - App will be available for internal review by selected Yukon government employees. February 2019 (complete)
2.	Unrestricted Private Beta - App will be available for review by both selected Yukon government employees and members of the general public. Targeted user testing will be conducted during this phase. March 2020 (complete)
3.	App Store Launch - Application will be available to the public to download from the Apple iOS app store or Android Google Play Store. Winter 2021.",Tourism and Culture,,OGL-Yukon-2.0,TC-PIA-2021-02,2021-01-13,2022-08-01 11:18:59,2022-08-01 11:18:59,https://open.yukon.ca/access-information/privacy-impact-assessment-summary/yukon-road-trip-application,56659
pia-summaries,Yukon Panorama,"This Privacy Impact Assessment (“PIA”) was conducted on behalf of the Yukon Department of Health and Social Services (“HSS”) on the current standing of the Panorama system. Panorama is a web-based public health information management tool that provides authorized public health users with the ability to collect, share and analyze a wide range of public health information that is critical for addressing public health problems. Panorama supports public health programs such as immunization, and communicable disease, outbreak management, inventory and family health. Panorama is a point-of-service system accessed by the service providers who deliver these services, conduct health surveillance activities, such as the monitoring of infectious diseases, and perform program evaluation within British Columbia (BC) and Yukon. 

Panorama is organized as seven major functional components: 
• Communicable disease investigation management,
• Outbreak management,
• Immunization management,
• Materials / Vaccine Inventory management,
• Notifications management,
• Work management, and
• Family Health management.",Health and Social Services,,OGL-Yukon-2.0,HSS-PIA-2022-06,2022-07-29,2022-08-01 13:22:38,2022-08-03 14:03:09,https://open.yukon.ca/access-information/privacy-impact-assessment-summary/yukon-panorama,56660
pia-summaries,Early Learning Child Care Website,"Early childhood educators need coordinate training and networking opportunities for professional development. This supports high quality early learning and child care and improved outcomes for Yukon children.
Currently, the Government of Yukon has no website presence for early learning and child care educators. This publicly available website is a requirement of the Canada-Yukon Early Learning and Child Care Agreement Annex 3 & 4 2021-22 and it aligns with the government's mandate to implement the Yukon's universal early child care program.
The benefits of a website for early childhood educators include:
* The Government can show it is prioritizing its commitments to improve early learning and child care in the Yukon.
* Early childhood educators, any of whom work in isolation or with limited capacity to collaborate, will have supports, networks and communities of practice to support them in providing high quality early learning.
*Early childhood educators will feel valued in their field. This will support staff retention which underpins consistent early learning and child care services to Yukon children and families.
We anticipate approximately 350 early childhood educators and 75 licensed programs will access the website annually.",Education,,OGL-Yukon-2.0,EDU-PIA-2022-01,2022-06-22,2022-08-02 08:31:22,2022-08-02 08:31:22,https://open.yukon.ca/access-information/privacy-impact-assessment-summary/early-learning-child-care-website,56663
pia-summaries,Yukon 511  Project,"Yukon government's (YG) Transportation Engineering Branch (TEB) leads and supports the Intelligent Transportation Systems (ITS) within YG. Part of this program development is the replacement of 511. TEB have historically been providers of bridge and highway work exclusively across Yukon, however, the branch has expanded with a team for ITS development and deployment. This team supports, leads and implements ITS projects across the Transportation Division and YG.
The Transportation Maintenance Branch (TMB) supports Yukon's multi-modal transportation systems. This is done with YG staff maintaining roads to a level that ensures safe and efficient use. Between TEB and TMB, is the management of highway rights-of-way and other lands and assets required for transportation purposes. Both branches develop and maintain 4,821 kilometers of Yukon roads.
YG currently has 11 highways and Yukon has a population of approximately 40,000, majority of which reside in Whitehorse. Most communities have cell connectivity, however, along most highways there is no cell service. Yukon's highways connect to British Columbia, Northwest Territories and Alaska. Temperatures can vary between -50C and +30C through the year. 
Currently, 511Yukon.ca is managed externally using the Telenium 511 system. This system is outdated and not adaptive to the constant technological change, and staff and public expectations of such a system.
YG requires a new Advanced Traveller Information Management System (ATIMS) to replace and improve upon the existing 511 Yukon platform, increase efficiencies on data management and provide a safety-driven, user-friendly interface to the public.
The development and evolution of the new Yukon 511 solution is an integral part of the Territory's future long-term transportation strategy. The new Yukon 511 is a cloud-based software called Travel-iQ provided and developed by IBI Group (IBI). The new Yukon 511 provides a secure, modern and supported system that provides centralized data management and a user-friendly ATIMS.
In replacing this system, the key functionality is focused on:
*road condition and traffic management;
*incident management;
*road and weather information systems;
*traffic control and management;
*work zone safety;
*Weight and bridge management; and
*data collection and management.
This new functionality includes providing detail information collected from various infrastructure elements put in place by the TEB ITS team, such as Mini road weather information systems, a data logger for roadbed temperature senor, radar traffic classifiers and traffic cameras. The information is then laid out on a visual map of the Yukon, allowing the public to see events, alerts, road closures and much more information.
A part of the new Yukon 511 system includes the ability for users to create an account if they wish. A user account is not required to use the Yukon 511 system. if a user signs up for an account, it allows for the user to create and save customized routes, create and save alerts for routes, create and save emergency alerts, set map layer preferences and personalize the camera view function (to display specific camera images).
No personal information is purposefully collected by any of the ITS infrastructure discussed above. however, the traffic cameras may inadvertently collect a person's image or an image of their vehicle. Please see the Traffic Cameras PIA for additional information.
The Yukon 511 system is accessible via website as well as a mobile application. The information in the system is the same between the website and mobile application. If the user chooses to provide the information while using the mobile application, route calculations and geolocation identification are collected. There is also an option to use the system over the phone, via an interactive voice response system (IVR), in which case a telephone number and audio recording of the telephone prompts are recorded for system improvement and audit purposes.
Web and audio analytics are also collected and used for system evaluation and improvements.",Highways and Public Works,,OGL-Yukon-2.0,HPW-PIA-2022-04,2022-04-25,2022-08-02 09:06:11,2024-06-24 11:03:13,https://open.yukon.ca/access-information/privacy-impact-assessment-summary/yukon-511-project,56664
pia-summaries,Video Surveillance System,"Yukon Housing Corporation (YHC) was established in 1972 under the Housing Corporation Act. The Corporation provides social housing to low income tenants and staff housing in the communities; lends money to Yukoners to become home-owners, repair their homes, or improve the energy efficiency of their homes; and assists seniors and people with disabilities to meet accessibility needs.
Many of the YHC building provide housing to seniors and vulnerable persons who have expressed concerns for their safety based on previous incidents. This project will deploy video surveillance cameras at 15 multi-unit housing buildings in Whitehorse. It will fulfill the desire to provide safe and secure housing facilities and answer tenants’ demands for 24/7 surveillance.",Yukon Housing Corporation,,OGL-Yukon-2.0,YHC-PIA-2022-01,2022-08-05,2022-08-11 07:57:46,2022-08-11 07:57:46,https://open.yukon.ca/access-information/privacy-impact-assessment-summary/video-surveillance-system,56676
pia-summaries,HSS Infolinx,"Infolinx is a records and information management software that enables the Yukon Government (“YG”) to track, manage, and audit the complete lifecycle of physical records. The software was initially implemented within YG in 2018 to replace an older file-level physical records management system. The Department of Health and Social Services (“HSS”) initiated use of the Infolinx software in February, 2022. Pervious privacy work has been conducted on the Infolinx system, including an HPW Privacy Impact Assessment (“PIA”) which was completed in March 2021. 

This HSS PIA will serve as a companion to the original HPW Infolinx PIA (2021) and highlight any differences or changes in the use of the Infolinx software within HSS, specifically to reference HIPMA as the legislative authority for the collection, use, and disclosure of Personal Health Information (“PHI”), and update the legal authority table for collection, use, and disclosure of Personal Information (PI) so it aligns with recent changes to the ATIPP Act.",Health and Social Services,,OGL-Yukon-2.0,HSS-PIA-2022-07,2022-08-10,2022-08-11 14:31:54,2022-08-11 14:31:54,https://open.yukon.ca/access-information/privacy-impact-assessment-summary/hss-infolinx,56678
pia-summaries,FormStack,"The TMB Safety and Operations Unit had developed and is using online forms (FormStack) for collecting and managing program information. These online forms are the New Hire Form, Driver Evaluation Form, and the Notification of Event Form.

FormStack is the data management solution that has been selected during a previous pilot wherein users of the forms include employees and management. The use of FormStack software for online forms will facilitate collection of Operational Management System data at TMB Safety and Operations to ensure Occupational Health and Safety Regulations are being met.",Highways and Public Works,,OGL-Yukon-2.0,HPW-PIA-2022-05,2022-08-26,2022-08-26 14:55:25,2022-08-26 14:55:25,https://open.yukon.ca/access-information/privacy-impact-assessment-summary/formstack,56697
pia-summaries,"People, Metrics, Analytics and Projects (PMAP)","The People, Metrics, Analytics and Projects (PMAP) Branch within the Public Service Commission (PSC) is responsible for providing information to senior leaders and decision makers to enable evidence and data based decisions. The branch is using existing PSC data and transforms it into illustrative and dynamic models. These models will assist HR and senior management with evidence-based HR decision making.
The current identified source databases are within the control and custody of PSC and include:
1. Human Resources Management System (HRMS)
2. YG Learn
3. E-recruitment
The benefit of evidence-based data is that strategic planning and resources can be targeted to address specific workplace and business issues. For example, the analysis of diversity metrics will enable the HR and Diversity Branch to plan and prioritise initiatives for attracting and retaining diverse candidates to the workplace.
Without metrics, resources may be randomly applied to initiatives that may not address gaps. Evidence-based data therefore facilitates efficient use of resources towards impactful business and workplace solutions.",Public Service Commission,,OGL-Yukon-2.0,PSC-PIA-2022-01,2022-09-08,2022-09-09 13:03:40,2022-09-09 13:03:40,https://open.yukon.ca/access-information/privacy-impact-assessment-summary/people-metrics-analytics-and-projects-pmap,56723
pia-summaries,One Government Approach to Safety (OGAS) - Safety Dashboard,"Yukon Workers Compensation Health and Safety Board (YWCHSB) collects claim information in order to administer and enforce the Worker's Compensation Act. Under the Workers' Compensation Act, employers have the right to information about a worker's work-related injury.
The Public Service Commission (PSC), as the employer of the Yukon Government, and the YWCHSB are entering into an information sharing agreement, in which the purpose of the agreement is to promote worker health and safety by using statistical information to understand the current claim trends and report on the findings. This will be done by developing a safety dashboard with aggregated data and supplying information to departments on aggregated claim information. Furthermore, PSC may use the information to respond to individual departmental information requests related to their overall claims (aggregated numbers only).
PSC will receive a monthly data extract (of Excel entries) containing details of all current claims submitted by YG employees. The data extract includes individual data sets that are anonymized, but, when combined with other information the employer may have or publicly available, could be used to identify an individual. The detailed information is required by the employer in order to provide summary reports based on the various data points provided. Datasets will be converted into diagrams on an Excel file.",Public Service Commission,,OGL-Yukon-2.0,PSC-PIA-2022-02,2022-04-22,2022-09-23 08:33:36,2022-09-23 08:33:36,https://open.yukon.ca/access-information/privacy-impact-assessment-summary/one-government-approach-safety-ogas-safety,56745
pia-summaries,eRebates Project,"The Department of Energy, Mines and Resources (EMR), Energy Branch, delivers energy efficiency programming to residential and commercial clients. Due to a 300% increase in program funding, developing a robust data management system will play a critical role in managing program expansion.
The purpose of the e-Rebates project is to enable the public to apply online for rebates and the ability to view energy program information.
The online form submission will improve the client's access and experience of applying for and receiving energy rebates. The initiative will reduce the lead time between client rebate submission and payment, simplify documentation requirements and reduce errors. Additionally, it will reduce administrative burden and data entry errors.
The objective of this initiative is to shorten the rebate payment timeframe from 8 weeks to 4 weeks. The Energy Branch will deploy a software as a Solution (SAAS) application system that will replace the existing developed in-house Access database to support this initiative.","Energy, Mines and Resources",,OGL-Yukon-2.0,EMR-PIA-2021-01,2019-10-07,2022-10-04 12:35:05,2022-10-04 12:35:05,https://open.yukon.ca/access-information/privacy-impact-assessment-summary/erebates-project,56755
pia-summaries,in1Touch Licensing Online System,"The Professional Licensing and Regulatory Affairs (PLRA) branch in Community Services Regulatory Affairs and Consumer Services program is implementing an online licensing system to manage the registration, licensing and regulation of Licensed Professional Nurses (LPN), Registered Psychiatric Nurses (RPN) and Physiotherapists. This new system, in1Touch, replaces current paper-based processes, and will allow for licensees to manage their applications and license renewals online.

The information collected, used and disclosed by PLRA is made in accordance with the Licensed Practical Nurses Act and Health Professions Act (Registered Psychiatric Nurses and Physiotherapists) and related regulations.",Community Services,,OGL-Yukon-2.0,CS-PIA-2022-02,2022-09-23,2022-10-11 15:07:38,2024-04-30 13:20:16,https://open.yukon.ca/access-information/privacy-impact-assessment-summary/in1touch-licensing-online-system,56763
